Blocked: 192.168.1.31 -> 104.18.32.47 | Reason: Source IP is blocked
Blocked: 192.168.1.31 -> 18.160.77.183 | Reason: Source IP is blocked
Blocked: 192.168.1.31 -> 13.33.249.107 | Reason: Source IP is blocked
Blocked: 192.168.1.31 -> 192.168.1.1 | Reason: Source IP is blocked
Blocked: 192.168.1.31 -> 192.168.1.1 | Reason: Source IP is blocked
Blocked: 192.168.1.31 -> 13.107.253.40 | Reason: Source IP is blocked
Blocked: 192.168.1.31 -> 13.107.253.40 | Reason: Source IP is blocked
Blocked: 192.168.1.31 -> 13.107.253.40 | Reason: Source IP is blocked
Blocked: 192.168.1.31 -> 13.107.253.40 | Reason: Source IP is blocked
Blocked: 192.168.1.31 -> 13.107.253.40 | Reason: Source IP is blocked
Blocked: 192.168.1.31 -> 13.107.253.40 | Reason: Source IP is blocked
Blocked: 192.168.1.31 -> 13.107.253.40 | Reason: Source IP is blocked
Blocked: 192.168.1.31 -> 13.107.253.40 | Reason: Source IP is blocked
Blocked: 192.168.1.31 -> 13.107.253.40 | Reason: Source IP is blocked
Blocked: 192.168.1.31 -> 13.107.253.40 | Reason: Source IP is blocked
Blocked: 192.168.1.31 -> 13.107.253.40 | Reason: Source IP is blocked
Blocked: 192.168.1.31 -> 13.107.253.40 | Reason: Source IP is blocked
Blocked: 192.168.1.31 -> 13.107.253.40 | Reason: Source IP is blocked
Blocked: 192.168.1.31 -> 13.107.253.40 | Reason: Source IP is blocked
Blocked: 192.168.1.31 -> 13.107.253.40 | Reason: Source IP is blocked
Blocked: 192.168.1.31 -> 13.107.253.40 | Reason: Source IP is blocked
Blocked: 192.168.1.31 -> 13.107.253.40 | Reason: Source IP is blocked
Blocked: 192.168.1.31 -> 13.107.253.40 | Reason: Source IP is blocked
Blocked: 192.168.1.31 -> 13.107.253.40 | Reason: Source IP is blocked
Blocked: 192.168.1.31 -> 13.107.253.40 | Reason: Source IP is blocked
Blocked: 192.168.1.31 -> 13.107.253.40 | Reason: Source IP is blocked
Blocked: 192.168.1.31 -> 13.107.253.40 | Reason: Source IP is blocked
Blocked: 192.168.1.31 -> 13.107.253.40 | Reason: Source IP is blocked
Blocked: 192.168.1.31 -> 13.107.253.40 | Reason: Source IP is blocked
Blocked: 192.168.1.31 -> 216.24.57.4 | Reason: Source IP is blocked
Blocked: 192.168.1.31 -> 40.104.46.50 | Reason: Source IP is blocked
Blocked: 192.168.1.31 -> 40.104.46.50 | Reason: Source IP is blocked
Blocked: 192.168.1.31 -> 192.178.32.7 | Reason: Source IP is blocked
Blocked: 192.168.1.31 -> 3.130.228.23 | Reason: Source IP is blocked
Blocked: 192.168.1.31 -> 208.103.161.2 | Reason: Source IP is blocked
Blocked: 192.168.1.31 -> 208.103.161.2 | Reason: Source IP is blocked
Blocked: 192.168.1.31 -> 104.18.35.15 | Reason: Source IP is blocked
Blocked: 192.168.1.31 -> 104.18.35.15 | Reason: Source IP is blocked
Blocked: 192.168.1.31 -> 104.18.35.15 | Reason: Source IP is blocked
Blocked: 192.168.1.31 -> 104.18.35.15 | Reason: Source IP is blocked
Blocked: 192.168.1.31 -> 104.18.35.15 | Reason: Source IP is blocked
Blocked: 192.168.1.31 -> 104.18.38.60 | Reason: Source IP is blocked
Blocked: 192.168.1.31 -> 104.18.38.60 | Reason: Source IP is blocked
Blocked: 192.168.1.31 -> 104.18.38.60 | Reason: Source IP is blocked
Blocked: 192.168.1.31 -> 104.18.38.60 | Reason: Source IP is blocked
Blocked: 192.168.1.31 -> 104.18.38.60 | Reason: Source IP is blocked
Blocked: 192.168.1.31 -> 23.194.165.55 | Reason: Source IP is blocked
Blocked: 192.168.1.31 -> 23.194.165.55 | Reason: Source IP is blocked
Blocked: 192.168.1.31 -> 23.194.165.55 | Reason: Source IP is blocked
Blocked: Ether / IP / TCP 192.168.1.31:62098 > 208.103.161.2:https PA / Raw | Reason: Source IP is blocked
Blocked: Ether / IP / TCP 192.168.1.31:63865 > 192.168.1.1:domain S | Reason: Source IP is blocked
Blocked: Ether / IP / TCP 192.168.1.31:63866 > 192.168.1.1:domain S | Reason: Source IP is blocked
Blocked: Ether / IP / TCP 192.168.1.31:63865 > 192.168.1.1:domain A | Reason: Source IP is blocked
Blocked: Ether / IP / TCP 192.168.1.31:63865 > 192.168.1.1:domain PA / Raw | Reason: Source IP is blocked
Blocked: Ether / IP / TCP 192.168.1.31:63865 > 192.168.1.1:domain PA / Raw | Reason: Source IP is blocked
Blocked: Ether / IP / TCP 192.168.1.31:63866 > 192.168.1.1:domain A | Reason: Source IP is blocked
Blocked: Ether / IP / TCP 192.168.1.31:63866 > 192.168.1.1:domain PA / Raw | Reason: Source IP is blocked
Blocked: Ether / IP / TCP 192.168.1.31:63866 > 192.168.1.1:domain PA / Raw | Reason: Source IP is blocked
Blocked: Ether / IP / TCP 192.168.1.31:63866 > 192.168.1.1:domain FA | Reason: Source IP is blocked
Blocked: Ether / IP / TCP 192.168.1.31:63865 > 192.168.1.1:domain FA | Reason: Source IP is blocked
Blocked: Ether / IP / UDP 192.168.1.31:52800 > 142.250.80.35:https / Raw | Reason: Source IP is blocked
Blocked: Ether / IP / UDP 192.168.1.31:52800 > 142.250.80.35:https / Raw | Reason: Source IP is blocked
Blocked: Ether / IP / UDP 192.168.1.31:52800 > 142.250.80.35:https / Raw | Reason: Source IP is blocked
Blocked: Ether / IP / UDP 192.168.1.31:52800 > 142.250.80.35:https / Raw | Reason: Source IP is blocked
Blocked: Ether / IP / TCP 192.168.1.31:63866 > 192.168.1.1:domain A | Reason: Source IP is blocked
Blocked: Ether / IP / TCP 192.168.1.31:63865 > 192.168.1.1:domain A | Reason: Source IP is blocked
Blocked: Ether / IP / UDP 192.168.1.31:52800 > 142.250.80.35:https / Raw | Reason: Source IP is blocked
Blocked: Ether / IP / UDP 192.168.1.31:52800 > 142.250.80.35:https / Raw | Reason: Source IP is blocked
Blocked: Ether / IP / UDP 192.168.1.31:52800 > 142.250.80.35:https / Raw | Reason: Source IP is blocked
Blocked: Ether / IP / UDP 192.168.1.31:52800 > 142.250.80.35:https / Raw | Reason: Source IP is blocked
Blocked: Ether / IP / UDP 192.168.1.31:52800 > 142.250.80.35:https / Raw | Reason: Source IP is blocked
Blocked: Ether / IP / TCP 192.168.1.31:62095 > 40.104.46.50:https PA / Raw | Reason: Source IP is blocked
Blocked: Ether / IP / TCP 192.168.1.31:62095 > 40.104.46.50:https PA / Raw | Reason: Source IP is blocked
Blocked: Ether / IP / TCP 192.168.1.31:63590 > 140.82.114.26:https A / Raw | Reason: Source IP is blocked
Blocked: Ether / IP / TCP 192.168.1.31:62085 > 142.251.167.188:5228 A / Raw | Reason: Source IP is blocked
Blocked: Ether / IP / TCP 192.168.1.31:62210 > 157.90.91.73:https A / Raw | Reason: Source IP is blocked
Blocked: Ether / IP / TCP 192.168.1.31:63868 > 192.168.1.1:domain S | Reason: Source IP is blocked
Blocked: Ether / IP / TCP 192.168.1.31:63869 > 192.168.1.1:domain S | Reason: Source IP is blocked
Blocked: Ether / IP / TCP 192.168.1.31:62140 > 104.18.35.15:https PA / Raw | Reason: Source IP is blocked
Blocked: Ether / IP / TCP 192.168.1.31:62140 > 104.18.35.15:https PA / Raw | Reason: Source IP is blocked
Blocked: Ether / IP / TCP 192.168.1.31:63868 > 192.168.1.1:domain A | Reason: Source IP is blocked
Blocked: Ether / IP / TCP 192.168.1.31:63869 > 192.168.1.1:domain A | Reason: Source IP is blocked
Blocked: Ether / IP / TCP 192.168.1.31:63868 > 192.168.1.1:domain PA / Raw | Reason: Source IP is blocked
Blocked: Ether / IP / TCP 192.168.1.31:63868 > 192.168.1.1:domain PA / Raw | Reason: Source IP is blocked
Blocked: Ether / IP / TCP 192.168.1.31:63869 > 192.168.1.1:domain PA / Raw | Reason: Source IP is blocked
Blocked: Ether / IP / TCP 192.168.1.31:63869 > 192.168.1.1:domain PA / Raw | Reason: Source IP is blocked
Blocked: Ether / IP / TCP 192.168.1.31:63869 > 192.168.1.1:domain FA | Reason: Source IP is blocked
Blocked: Ether / IP / TCP 192.168.1.31:63869 > 192.168.1.1:domain A | Reason: Source IP is blocked
Blocked: Ether / IP / TCP 192.168.1.31:63868 > 192.168.1.1:domain FA | Reason: Source IP is blocked
Blocked: Ether / IP / TCP 192.168.1.31:63868 > 192.168.1.1:domain A | Reason: Source IP is blocked
Blocked: Ether / IP / TCP 192.168.1.31:62140 > 104.18.35.15:https A | Reason: Source IP is blocked
Blocked: Ether / IP / TCP 192.168.1.31:62140 > 104.18.35.15:https PA / Raw | Reason: Source IP is blocked
Blocked: Ether / IP / TCP 192.168.1.31:63870 > 192.168.1.1:domain S | Reason: Source IP is blocked
Blocked: Ether / IP / TCP 192.168.1.31:63871 > 192.168.1.1:domain S | Reason: Source IP is blocked
Blocked: Ether / IP / TCP 192.168.1.31:62143 > 104.18.38.60:https PA / Raw | Reason: Source IP is blocked
Blocked: Ether / IP / TCP 192.168.1.31:62143 > 104.18.38.60:https PA / Raw | Reason: Source IP is blocked
Blocked: Ether / IP / TCP 192.168.1.31:63870 > 192.168.1.1:domain A | Reason: Source IP is blocked
Blocked: Ether / IP / TCP 192.168.1.31:63870 > 192.168.1.1:domain PA / Raw | Reason: Source IP is blocked
Blocked: Ether / IP / TCP 192.168.1.31:63870 > 192.168.1.1:domain PA / Raw | Reason: Source IP is blocked
Blocked: Ether / IP / TCP 192.168.1.31:63871 > 192.168.1.1:domain A | Reason: Source IP is blocked
Blocked: Ether / IP / TCP 192.168.1.31:63871 > 192.168.1.1:domain PA / Raw | Reason: Source IP is blocked
Blocked: Ether / IP / TCP 192.168.1.31:63871 > 192.168.1.1:domain PA / Raw | Reason: Source IP is blocked
Blocked: Ether / IP / TCP 192.168.1.31:63871 > 192.168.1.1:domain FA | Reason: Source IP is blocked
Blocked: Ether / IP / TCP 192.168.1.31:63870 > 192.168.1.1:domain FA | Reason: Source IP is blocked
Blocked: Ether / IP / TCP 192.168.1.31:63870 > 192.168.1.1:domain A | Reason: Source IP is blocked
Blocked: Ether / IP / TCP 192.168.1.31:63871 > 192.168.1.1:domain A | Reason: Source IP is blocked
Blocked: Ether / IP / TCP 192.168.1.31:62143 > 104.18.38.60:https A | Reason: Source IP is blocked
Blocked: Ether / IP / TCP 192.168.1.31:62143 > 104.18.38.60:https PA / Raw | Reason: Source IP is blocked
Blocked: Ether / IP / TCP 192.168.1.31:62098 > 208.103.161.2:https PA / Raw | Reason: TCP packet to blocked port 443
Blocked: Ether / IP / TCP 192.168.1.31:62140 > 104.18.35.15:https PA / Raw | Reason: TCP packet to blocked port 443
Blocked: Ether / IP / TCP 192.168.1.31:62140 > 104.18.35.15:https PA / Raw | Reason: TCP packet to blocked port 443
Blocked: Ether / IP / TCP 192.168.1.31:62140 > 104.18.35.15:https A | Reason: TCP packet to blocked port 443
Blocked: Ether / IP / TCP 192.168.1.31:62140 > 104.18.35.15:https A | Reason: TCP packet to blocked port 443
Blocked: Ether / IP / TCP 192.168.1.31:62140 > 104.18.35.15:https A | Reason: TCP packet to blocked port 443
Blocked: Ether / IP / TCP 192.168.1.31:62140 > 104.18.35.15:https PA / Raw | Reason: TCP packet to blocked port 443
Blocked: Ether / IP / TCP 192.168.1.31:62143 > 104.18.38.60:https PA / Raw | Reason: TCP packet to blocked port 443
Blocked: Ether / IP / TCP 192.168.1.31:62143 > 104.18.38.60:https PA / Raw | Reason: TCP packet to blocked port 443
Blocked: Ether / IP / TCP 192.168.1.31:62143 > 104.18.38.60:https A | Reason: TCP packet to blocked port 443
Blocked: Ether / IP / TCP 192.168.1.31:62143 > 104.18.38.60:https PA / Raw | Reason: TCP packet to blocked port 443
Blocked: Ether / IP / TCP 192.168.1.31:63673 > 3.132.230.19:https PA / Raw | Reason: TCP packet to blocked port 443
Blocked: Ether / IP / TCP 192.168.1.31:62990 > 192.178.32.7:https A / Raw | Reason: TCP packet to blocked port 443
Blocked: Ether / IP / TCP 192.168.1.31:63590 > 140.82.114.26:https PA / Raw | Reason: TCP packet to blocked port 443
Blocked: Ether / IP / TCP 192.168.1.31:62210 > 157.90.91.73:https A / Raw | Reason: TCP packet to blocked port 443
Blocked: Ether / IP / TCP 192.168.1.31:63667 > 172.64.155.209:https A / Raw | Reason: TCP packet to blocked port 443
Blocked: Ether / IP / ICMP 192.168.1.31 > 192.168.1.1 echo-request 0 / Raw | Reason: Blocked ICMP protocol
Blocked: Ether / IP / ICMP 192.168.1.1 > 192.168.1.31 echo-reply 0 / Raw | Reason: Blocked ICMP protocol
Blocked: Ether / IP / ICMP 192.168.1.31 > 192.168.1.1 echo-request 0 / Raw | Reason: Blocked ICMP protocol
Blocked: Ether / IP / ICMP 192.168.1.1 > 192.168.1.31 echo-reply 0 / Raw | Reason: Blocked ICMP protocol
Blocked: Ether / IP / TCP 192.168.1.31:62095 > 40.104.46.50:https PA / Raw | Reason: TCP packet to blocked port 443
Blocked: Ether / IP / TCP 192.168.1.31:62095 > 40.104.46.50:https PA / Raw | Reason: TCP packet to blocked port 443
Blocked: Ether / IP / ICMP 192.168.1.31 > 192.168.1.1 echo-request 0 / Raw | Reason: Blocked ICMP protocol
Blocked: Ether / IP / ICMP 192.168.1.1 > 192.168.1.31 echo-reply 0 / Raw | Reason: Blocked ICMP protocol
Blocked: Ether / IP / TCP 192.168.1.31:63952 > 108.138.114.80:https A / Raw | Reason: TCP packet to blocked port 443
Blocked: Ether / IP / ICMP 192.168.1.31 > 192.168.1.1 echo-request 0 / Raw | Reason: Blocked ICMP protocol
Blocked: Ether / IP / ICMP 192.168.1.1 > 192.168.1.31 echo-reply 0 / Raw | Reason: Blocked ICMP protocol
Blocked: Ether / IP / TCP 192.168.1.31:62095 > 40.104.46.50:https PA / Raw | Reason: TCP packet to blocked port 443
Blocked: Ether / IP / TCP 192.168.1.31:62095 > 40.104.46.50:https PA / Raw | Reason: TCP packet to blocked port 443
Blocked: Ether / IP / UDP 192.168.1.31:63878 > 208.103.161.2:https / Raw | Reason: UDP packet to blocked port 443
Blocked: Ether / IP / UDP 192.168.1.31:63878 > 208.103.161.2:https / Raw | Reason: UDP packet to blocked port 443
Blocked: Ether / IP / UDP 192.168.1.31:63878 > 208.103.161.2:https / Raw | Reason: UDP packet to blocked port 443
Blocked: Ether / IP / UDP 192.168.1.31:63878 > 208.103.161.2:https / Raw | Reason: UDP packet to blocked port 443
Blocked: Ether / IP / UDP 192.168.1.31:63878 > 208.103.161.2:https / Raw | Reason: UDP packet to blocked port 443
Blocked: Ether / IP / TCP 192.168.1.31:62095 > 40.104.46.50:https A | Reason: TCP packet to blocked port 443
Blocked: Ether / IP / UDP 192.168.1.31:63878 > 208.103.161.2:https / Raw | Reason: UDP packet to blocked port 443
Blocked: Ether / IP / UDP 192.168.1.31:63878 > 208.103.161.2:https / Raw | Reason: UDP packet to blocked port 443
Blocked: Ether / IP / TCP 192.168.1.31:62095 > 40.104.46.50:https A | Reason: TCP packet to blocked port 443
Blocked: Ether / IP / UDP 192.168.1.31:63878 > 208.103.161.2:https / Raw | Reason: UDP packet to blocked port 443
Blocked: Ether / IP / UDP 192.168.1.31:63878 > 208.103.161.2:https / Raw | Reason: UDP packet to blocked port 443
Blocked: Ether / IP / UDP 192.168.1.31:63878 > 208.103.161.2:https / Raw | Reason: UDP packet to blocked port 443
Blocked: Ether / IP / UDP 192.168.1.31:63878 > 208.103.161.2:https / Raw | Reason: UDP packet to blocked port 443
Blocked: Ether / IP / TCP 192.168.1.31:62097 > 208.103.161.2:https PA / Raw | Reason: TCP packet to blocked port 443
Blocked: Ether / IP / TCP 192.168.1.31:62098 > 208.103.161.2:https PA / Raw | Reason: TCP packet to blocked port 443
Blocked: Ether / IP / TCP 192.168.1.31:62095 > 40.104.46.50:https PA / Raw | Reason: TCP packet to blocked port 443
Blocked: Ether / IP / TCP 192.168.1.31:62095 > 40.104.46.50:https A | Reason: TCP packet to blocked port 443
Blocked: Ether / IP / TCP 192.168.1.31:62095 > 40.104.46.50:https PA / Raw | Reason: TCP packet to blocked port 443
Blocked: Ether / IP / TCP 192.168.1.31:62095 > 40.104.46.50:https PA / Raw | Reason: TCP packet to blocked port 443
Blocked: Ether / IP / TCP 192.168.1.31:64211 > 13.107.5.93:https S | Reason: TCP packet to blocked port 443
Blocked: Ether / IP / TCP 192.168.1.31:64211 > 13.107.5.93:https A | Reason: TCP packet to blocked port 443
Blocked: Ether / IP / TCP 192.168.1.31:64211 > 13.107.5.93:https PA / Raw | Reason: TCP packet to blocked port 443
Blocked: Ether / IP / TCP 192.168.1.31:64211 > 13.107.5.93:https PA / Raw | Reason: TCP packet to blocked port 443
Blocked: Ether / IP / TCP 192.168.1.31:64211 > 13.107.5.93:https A | Reason: TCP packet to blocked port 443
Blocked: Ether / IP / TCP 192.168.1.31:64211 > 13.107.5.93:https PA / Raw | Reason: TCP packet to blocked port 443
Blocked: Ether / IP / TCP 192.168.1.31:64211 > 13.107.5.93:https A | Reason: TCP packet to blocked port 443
Blocked: Ether / IP / TCP 192.168.1.31:64212 > 13.107.5.93:https S | Reason: TCP packet to blocked port 443
Blocked: Ether / IP / TCP 192.168.1.31:64212 > 13.107.5.93:https A | Reason: TCP packet to blocked port 443
Blocked: Ether / IP / TCP 192.168.1.31:64212 > 13.107.5.93:https PA / Raw | Reason: TCP packet to blocked port 443
Blocked: Ether / IP / TCP 192.168.1.31:64212 > 13.107.5.93:https PA / Raw | Reason: TCP packet to blocked port 443
Blocked: Ether / IP / TCP 192.168.1.31:64212 > 13.107.5.93:https A | Reason: TCP packet to blocked port 443
Blocked: Ether / IP / TCP 192.168.1.31:64212 > 13.107.5.93:https PA / Raw | Reason: TCP packet to blocked port 443
Blocked: Ether / IP / TCP 192.168.1.31:64213 > 13.107.5.93:https S | Reason: TCP packet to blocked port 443
Blocked: Ether / IP / TCP 192.168.1.31:64213 > 13.107.5.93:https A | Reason: TCP packet to blocked port 443
Blocked: Ether / IP / TCP 192.168.1.31:64213 > 13.107.5.93:https PA / Raw | Reason: TCP packet to blocked port 443
Blocked: Ether / IP / TCP 192.168.1.31:64212 > 13.107.5.93:https A | Reason: TCP packet to blocked port 443
Blocked: Ether / IP / TCP 192.168.1.31:64213 > 13.107.5.93:https PA / Raw | Reason: TCP packet to blocked port 443
Blocked: Ether / IP / TCP 192.168.1.31:64213 > 13.107.5.93:https A | Reason: TCP packet to blocked port 443
Blocked: Ether / IP / TCP 192.168.1.31:64213 > 13.107.5.93:https PA / Raw | Reason: TCP packet to blocked port 443
Blocked: Ether / IP / TCP 192.168.1.31:64213 > 13.107.5.93:https A | Reason: TCP packet to blocked port 443
Blocked: Ether / IP / TCP 192.168.1.31:64214 > 13.107.246.40:https S | Reason: TCP packet to blocked port 443
Blocked: Ether / IP / TCP 192.168.1.31:64214 > 13.107.246.40:https A | Reason: TCP packet to blocked port 443
Blocked: Ether / IP / TCP 192.168.1.31:64214 > 13.107.246.40:https PA / Raw | Reason: TCP packet to blocked port 443
Blocked: Ether / IP / TCP 192.168.1.31:64214 > 13.107.246.40:https PA / Raw | Reason: TCP packet to blocked port 443
Blocked: Ether / IP / TCP 192.168.1.31:64214 > 13.107.246.40:https A | Reason: TCP packet to blocked port 443
Blocked: Ether / IP / TCP 192.168.1.31:64214 > 13.107.246.40:https A | Reason: TCP packet to blocked port 443
Blocked: Ether / IP / TCP 192.168.1.31:64214 > 13.107.246.40:https PA / Raw | Reason: TCP packet to blocked port 443
Blocked: Ether / IP / TCP 192.168.1.31:64214 > 13.107.246.40:https PA / Raw | Reason: TCP packet to blocked port 443
Blocked: Ether / IP / TCP 192.168.1.31:64214 > 13.107.246.40:https PA / Raw | Reason: TCP packet to blocked port 443
Blocked: Ether / IP / TCP 192.168.1.31:64214 > 13.107.246.40:https A | Reason: TCP packet to blocked port 443
Blocked: Ether / IP / TCP 192.168.1.31:64214 > 13.107.246.40:https PA / Raw | Reason: TCP packet to blocked port 443
Blocked: Ether / IP / TCP 192.168.1.31:64214 > 13.107.246.40:https A | Reason: TCP packet to blocked port 443
Blocked: Ether / IP / TCP 192.168.1.31:64214 > 13.107.246.40:https A | Reason: TCP packet to blocked port 443
Blocked: Ether / IP / TCP 192.168.1.31:64214 > 13.107.246.40:https A | Reason: TCP packet to blocked port 443
Blocked: Ether / IP / TCP 192.168.1.31:64214 > 13.107.246.40:https A | Reason: TCP packet to blocked port 443
Blocked: Ether / IP / TCP 192.168.1.31:64214 > 13.107.246.40:https A | Reason: TCP packet to blocked port 443
Blocked: Ether / IP / TCP 192.168.1.31:64214 > 13.107.246.40:https A | Reason: TCP packet to blocked port 443
Blocked: Ether / IP / TCP 192.168.1.31:63952 > 108.138.114.80:https A / Raw | Reason: TCP packet to blocked port 443
Blocked: Ether / IP / TCP 192.168.1.31:64211 > 13.107.5.93:https FA | Reason: TCP packet to blocked port 443
Blocked: Ether / IP / TCP 192.168.1.31:64211 > 13.107.5.93:https A | Reason: TCP packet to blocked port 443
Blocked: Ether / IP / TCP 192.168.1.31:64211 > 13.107.5.93:https A | Reason: TCP packet to blocked port 443
Blocked: Ether / IP / TCP 192.168.1.31:64212 > 13.107.5.93:https FA | Reason: TCP packet to blocked port 443
Blocked: Ether / IP / TCP 192.168.1.31:64212 > 13.107.5.93:https A | Reason: TCP packet to blocked port 443
Blocked: Ether / IP / TCP 192.168.1.31:64212 > 13.107.5.93:https A | Reason: TCP packet to blocked port 443
Blocked: Ether / IP / TCP 192.168.1.31:64213 > 13.107.5.93:https FA | Reason: TCP packet to blocked port 443
Blocked: Ether / IP / TCP 192.168.1.31:64213 > 13.107.5.93:https A | Reason: TCP packet to blocked port 443
Blocked: Ether / IP / TCP 192.168.1.31:64213 > 13.107.5.93:https A | Reason: TCP packet to blocked port 443
Blocked: Ether / IP / TCP 192.168.1.31:64174 > 52.21.152.152:https A | Reason: TCP packet to blocked port 443
Blocked: Ether / IP / TCP 192.168.1.31:64174 > 52.21.152.152:https A | Reason: TCP packet to blocked port 443
Blocked: Ether / IP / TCP 192.168.1.31:62097 > 208.103.161.2:https PA / Raw | Reason: TCP packet to blocked port 443
Blocked: Ether / IP / TCP 192.168.1.31:62098 > 208.103.161.2:https PA / Raw | Reason: TCP packet to blocked port 443
Blocked: Ether / IP / TCP 192.168.1.31:62095 > 40.104.46.50:https PA / Raw | Reason: TCP packet to blocked port 443
Blocked: Ether / IP / TCP 192.168.1.31:62095 > 40.104.46.50:https PA / Raw | Reason: TCP packet to blocked port 443
Blocked: Ether / IP / TCP 192.168.1.31:64177 > 52.20.251.94:https A | Reason: TCP packet to blocked port 443
Blocked: Ether / IP / TCP 192.168.1.31:64177 > 52.20.251.94:https A | Reason: TCP packet to blocked port 443
Blocked: Ether / IP / TCP 192.168.1.31:63590 > 140.82.114.26:https A / Raw | Reason: TCP packet to blocked port 443
Blocked: Ether / IP / TCP 192.168.1.31:64225 > 20.190.151.6:https S | Reason: TCP packet to blocked port 443
Blocked: Ether / IP / TCP 192.168.1.31:64225 > 20.190.151.6:https A | Reason: TCP packet to blocked port 443
Blocked: Ether / IP / TCP 192.168.1.31:64225 > 20.190.151.6:https PA / Raw | Reason: TCP packet to blocked port 443
Blocked: Ether / IP / TCP 192.168.1.31:64225 > 20.190.151.6:https A | Reason: TCP packet to blocked port 443
Blocked: Ether / IP / TCP 192.168.1.31:64225 > 20.190.151.6:https PA / Raw | Reason: TCP packet to blocked port 443
Blocked: Ether / IP / TCP 192.168.1.31:64225 > 20.190.151.6:https PA / Raw | Reason: TCP packet to blocked port 443
Blocked: Ether / IP / TCP 192.168.1.31:64225 > 20.190.151.6:https PA / Raw | Reason: TCP packet to blocked port 443
Blocked: Ether / IP / TCP 192.168.1.31:64225 > 20.190.151.6:https A | Reason: TCP packet to blocked port 443
Blocked: Ether / IP / TCP 192.168.1.31:64225 > 20.190.151.6:https A | Reason: TCP packet to blocked port 443
Blocked: Ether / IP / TCP 192.168.1.31:64225 > 20.190.151.6:https A | Reason: TCP packet to blocked port 443
Blocked: Ether / IP / TCP 192.168.1.31:64226 > 40.119.249.228:https S | Reason: TCP packet to blocked port 443
Blocked: Ether / IP / TCP 192.168.1.31:64226 > 40.119.249.228:https A | Reason: TCP packet to blocked port 443
Blocked: Ether / IP / TCP 192.168.1.31:64226 > 40.119.249.228:https PA / Raw | Reason: TCP packet to blocked port 443
Blocked: Ether / IP / TCP 192.168.1.31:64226 > 40.119.249.228:https A | Reason: TCP packet to blocked port 443
Blocked: Ether / IP / TCP 192.168.1.31:64226 > 40.119.249.228:https PA / Raw | Reason: TCP packet to blocked port 443
Blocked: Ether / IP / TCP 192.168.1.31:64226 > 40.119.249.228:https A | Reason: TCP packet to blocked port 443
Blocked: Ether / IP / TCP 192.168.1.31:64226 > 40.119.249.228:https PA / Raw | Reason: TCP packet to blocked port 443
Blocked: Ether / IP / TCP 192.168.1.31:64226 > 40.119.249.228:https PA / Raw | Reason: TCP packet to blocked port 443
Blocked: Ether / IP / TCP 192.168.1.31:64226 > 40.119.249.228:https PA / Raw | Reason: TCP packet to blocked port 443
Blocked: Ether / IP / TCP 192.168.1.31:64226 > 40.119.249.228:https A | Reason: TCP packet to blocked port 443
Blocked: Ether / IP / TCP 192.168.1.31:64226 > 40.119.249.228:https FA | Reason: TCP packet to blocked port 443
Blocked: Ether / IP / TCP 192.168.1.31:64226 > 40.119.249.228:https A | Reason: TCP packet to blocked port 443
Blocked: Ether / IP / TCP 192.168.1.31:64226 > 40.119.249.228:https RA | Reason: TCP packet to blocked port 443
Blocked: Ether / IP / TCP 192.168.1.31:62140 > 104.18.35.15:https PA / Raw | Reason: TCP packet to blocked port 443
Blocked: Ether / IP / TCP 192.168.1.31:62140 > 104.18.35.15:https PA / Raw | Reason: TCP packet to blocked port 443
Blocked: Ether / IP / TCP 192.168.1.31:62140 > 104.18.35.15:https A | Reason: TCP packet to blocked port 443
Blocked: Ether / IP / TCP 192.168.1.31:62140 > 104.18.35.15:https A | Reason: TCP packet to blocked port 443
Blocked: Ether / IP / TCP 192.168.1.31:62140 > 104.18.35.15:https PA / Raw | Reason: TCP packet to blocked port 443
Blocked: Ether / IP / TCP 192.168.1.31:62143 > 104.18.38.60:https PA / Raw | Reason: TCP packet to blocked port 443
Blocked: Ether / IP / TCP 192.168.1.31:62143 > 104.18.38.60:https PA / Raw | Reason: TCP packet to blocked port 443
Blocked: Ether / IP / TCP 192.168.1.31:62143 > 104.18.38.60:https A | Reason: TCP packet to blocked port 443
Blocked: Ether / IP / TCP 192.168.1.31:62143 > 104.18.38.60:https PA / Raw | Reason: TCP packet to blocked port 443
Blocked: Ether / IP / TCP 192.168.1.31:62931 > 192.178.32.7:https A / Raw | Reason: TCP packet to blocked port 443
Blocked: Ether / IP / TCP 192.168.1.31:64232 > 13.107.5.93:https S | Reason: TCP packet to blocked port 443
Blocked: Ether / IP / TCP 192.168.1.31:64232 > 13.107.5.93:https A | Reason: TCP packet to blocked port 443
Blocked: Ether / IP / TCP 192.168.1.31:64232 > 13.107.5.93:https PA / Raw | Reason: TCP packet to blocked port 443
Blocked: Ether / IP / TCP 192.168.1.31:64232 > 13.107.5.93:https PA / Raw | Reason: TCP packet to blocked port 443
Blocked: Ether / IP / TCP 192.168.1.31:64232 > 13.107.5.93:https A | Reason: TCP packet to blocked port 443
Blocked: Ether / IP / TCP 192.168.1.31:64232 > 13.107.5.93:https PA / Raw | Reason: TCP packet to blocked port 443
Blocked: Ether / IP / TCP 192.168.1.31:64233 > 13.107.5.93:https S | Reason: TCP packet to blocked port 443
Blocked: Ether / IP / TCP 192.168.1.31:64232 > 13.107.5.93:https A | Reason: TCP packet to blocked port 443
Blocked: Ether / IP / TCP 192.168.1.31:62097 > 208.103.161.2:https PA / Raw | Reason: TCP packet to blocked port 443
Blocked: Ether / IP / TCP 192.168.1.31:64233 > 13.107.5.93:https A | Reason: TCP packet to blocked port 443
Blocked: Ether / IP / TCP 192.168.1.31:64233 > 13.107.5.93:https PA / Raw | Reason: TCP packet to blocked port 443
Blocked: Ether / IP / TCP 192.168.1.31:64233 > 13.107.5.93:https PA / Raw | Reason: TCP packet to blocked port 443
Blocked: Ether / IP / TCP 192.168.1.31:64233 > 13.107.5.93:https A | Reason: TCP packet to blocked port 443
Blocked: Ether / IP / TCP 192.168.1.31:64233 > 13.107.5.93:https PA / Raw | Reason: TCP packet to blocked port 443
Blocked: Ether / IP / TCP 192.168.1.31:64233 > 13.107.5.93:https A | Reason: TCP packet to blocked port 443
Blocked: Ether / IP / TCP 192.168.1.31:64234 > 13.107.5.93:https S | Reason: TCP packet to blocked port 443
Blocked: Ether / IP / TCP 192.168.1.31:64234 > 13.107.5.93:https A | Reason: TCP packet to blocked port 443
Blocked: Ether / IP / TCP 192.168.1.31:64234 > 13.107.5.93:https PA / Raw | Reason: TCP packet to blocked port 443
Blocked: Ether / IP / TCP 192.168.1.31:64234 > 13.107.5.93:https PA / Raw | Reason: TCP packet to blocked port 443
Blocked: Ether / IP / TCP 192.168.1.31:64234 > 13.107.5.93:https A | Reason: TCP packet to blocked port 443
Blocked: Ether / IP / TCP 192.168.1.31:64234 > 13.107.5.93:https PA / Raw | Reason: TCP packet to blocked port 443
Blocked: Ether / IP / TCP 192.168.1.31:64234 > 13.107.5.93:https A | Reason: TCP packet to blocked port 443
Blocked: Ether / IP / TCP 192.168.1.31:62098 > 208.103.161.2:https PA / Raw | Reason: TCP packet to blocked port 443
Blocked: Ether / IP / TCP 192.168.1.31:64232 > 13.107.5.93:https FA | Reason: TCP packet to blocked port 443
Blocked: Ether / IP / TCP 192.168.1.31:64232 > 13.107.5.93:https A | Reason: TCP packet to blocked port 443
Blocked: Ether / IP / TCP 192.168.1.31:64232 > 13.107.5.93:https A | Reason: TCP packet to blocked port 443
Blocked: Ether / IP / TCP 192.168.1.31:64233 > 13.107.5.93:https FA | Reason: TCP packet to blocked port 443
Blocked: Ether / IP / TCP 192.168.1.31:64233 > 13.107.5.93:https A | Reason: TCP packet to blocked port 443
Blocked: Ether / IP / TCP 192.168.1.31:64233 > 13.107.5.93:https A | Reason: TCP packet to blocked port 443
Blocked: Ether / IP / TCP 192.168.1.31:64234 > 13.107.5.93:https FA | Reason: TCP packet to blocked port 443
Blocked: Ether / IP / TCP 192.168.1.31:64234 > 13.107.5.93:https A | Reason: TCP packet to blocked port 443
Blocked: Ether / IP / TCP 192.168.1.31:64234 > 13.107.5.93:https A | Reason: TCP packet to blocked port 443
Blocked: Ether / IP / TCP 192.168.1.31:63590 > 140.82.114.26:https PA / Raw | Reason: TCP packet to blocked port 443
Blocked: Ether / IP / TCP 192.168.1.31:62210 > 157.90.91.73:https A / Raw | Reason: TCP packet to blocked port 443
Blocked: Ether / IP / TCP 192.168.1.31:62095 > 40.104.46.50:https PA / Raw | Reason: TCP packet to blocked port 443
Blocked: Ether / IP / TCP 192.168.1.31:62095 > 40.104.46.50:https PA / Raw | Reason: TCP packet to blocked port 443
Blocked: Ether / IP / TCP 192.168.1.31:64239 > 20.72.205.209:https S | Reason: TCP packet to blocked port 443
Blocked: Ether / IP / TCP 192.168.1.31:64239 > 20.72.205.209:https A | Reason: TCP packet to blocked port 443
Blocked: Ether / IP / TCP 192.168.1.31:64239 > 20.72.205.209:https PA / Raw | Reason: TCP packet to blocked port 443
Blocked: Ether / IP / TCP 192.168.1.31:64239 > 20.72.205.209:https A | Reason: TCP packet to blocked port 443
Blocked: Ether / IP / TCP 192.168.1.31:64239 > 20.72.205.209:https PA / Raw | Reason: TCP packet to blocked port 443
Blocked: Ether / IP / TCP 192.168.1.31:64239 > 20.72.205.209:https A | Reason: TCP packet to blocked port 443
Blocked: Ether / IP / TCP 192.168.1.31:64239 > 20.72.205.209:https PA / Raw | Reason: TCP packet to blocked port 443
Blocked: Ether / IP / TCP 192.168.1.31:64239 > 20.72.205.209:https PA / Raw | Reason: TCP packet to blocked port 443
Blocked: Ether / IP / TCP 192.168.1.31:64239 > 20.72.205.209:https PA / Raw | Reason: TCP packet to blocked port 443
Blocked: Ether / IP / TCP 192.168.1.31:64239 > 20.72.205.209:https A | Reason: TCP packet to blocked port 443
Blocked: Ether / IP / TCP 192.168.1.31:64239 > 20.72.205.209:https FA | Reason: TCP packet to blocked port 443
Blocked: Ether / IP / TCP 192.168.1.31:64239 > 20.72.205.209:https A | Reason: TCP packet to blocked port 443
Blocked: Ether / IP / TCP 192.168.1.31:64239 > 20.72.205.209:https RA | Reason: TCP packet to blocked port 443
Blocked: Ether / IP / TCP 192.168.1.31:64370 > 52.182.141.63:https S | Reason: TCP packet to blocked port 443
Blocked: Ether / IP / TCP 192.168.1.31:62095 > 40.104.46.50:https PA / Raw | Reason: TCP packet to blocked port 443
Blocked: Ether / IP / TCP 192.168.1.31:62095 > 40.104.46.50:https PA / Raw | Reason: TCP packet to blocked port 443
Blocked: Ether / IP / TCP 192.168.1.31:64370 > 52.182.141.63:https A | Reason: TCP packet to blocked port 443
Blocked: Ether / IP / TCP 192.168.1.31:64370 > 52.182.141.63:https PA / Raw | Reason: TCP packet to blocked port 443
Blocked: Ether / IP / UDP 192.168.1.31:61491 > 172.217.165.142:https / Raw | Reason: UDP packet to blocked port 443
Blocked: Ether / IP / UDP 192.168.1.31:61491 > 172.217.165.142:https / Raw | Reason: UDP packet to blocked port 443
Blocked: Ether / IP / UDP 192.168.1.31:61491 > 172.217.165.142:https / Raw | Reason: UDP packet to blocked port 443
Blocked: Ether / IP / TCP 192.168.1.31:64370 > 52.182.141.63:https PA / Raw | Reason: TCP packet to blocked port 443
Blocked: Ether / IP / UDP 192.168.1.31:61491 > 172.217.165.142:https / Raw | Reason: UDP packet to blocked port 443
Blocked: Ether / IP / UDP 192.168.1.31:61491 > 172.217.165.142:https / Raw | Reason: UDP packet to blocked port 443
Blocked: Ether / IP / UDP 192.168.1.31:61491 > 172.217.165.142:https / Raw | Reason: UDP packet to blocked port 443
Blocked: Ether / IP / UDP 192.168.1.31:61491 > 172.217.165.142:https / Raw | Reason: UDP packet to blocked port 443
Blocked: Ether / IP / UDP 192.168.1.31:61491 > 172.217.165.142:https / Raw | Reason: UDP packet to blocked port 443
Blocked: Ether / IP / UDP 192.168.1.31:61491 > 172.217.165.142:https / Raw | Reason: UDP packet to blocked port 443
Blocked: Ether / IP / TCP 192.168.1.31:62095 > 40.104.46.50:https A | Reason: TCP packet to blocked port 443
Blocked: Ether / IP / UDP 192.168.1.31:61491 > 172.217.165.142:https / Raw | Reason: UDP packet to blocked port 443
Blocked: Ether / IP / TCP 192.168.1.31:64370 > 52.182.141.63:https A | Reason: TCP packet to blocked port 443
Blocked: Ether / IP / TCP 192.168.1.31:64370 > 52.182.141.63:https PA / Raw | Reason: TCP packet to blocked port 443
Blocked: Ether / IP / TCP 192.168.1.31:62095 > 40.104.46.50:https A | Reason: TCP packet to blocked port 443
Blocked: Ether / IP / UDP 192.168.1.31:61491 > 172.217.165.142:https / Raw | Reason: UDP packet to blocked port 443
Blocked: Ether / IP / UDP 192.168.1.31:61491 > 172.217.165.142:https / Raw | Reason: UDP packet to blocked port 443
Blocked: Ether / IP / TCP 192.168.1.31:64370 > 52.182.141.63:https A | Reason: TCP packet to blocked port 443
Blocked: Ether / IP / TCP 192.168.1.31:64370 > 52.182.141.63:https PA / Raw | Reason: TCP packet to blocked port 443
Blocked: Ether / IP / TCP 192.168.1.31:64370 > 52.182.141.63:https FA | Reason: TCP packet to blocked port 443
Blocked: Ether / IP / TCP 192.168.1.31:62095 > 40.104.46.50:https PA / Raw | Reason: TCP packet to blocked port 443
Blocked: Ether / IP / TCP 192.168.1.31:62095 > 40.104.46.50:https PA / Raw | Reason: TCP packet to blocked port 443
Blocked: Ether / IP / TCP 192.168.1.31:62095 > 40.104.46.50:https A | Reason: TCP packet to blocked port 443
Blocked: Ether / IP / TCP 192.168.1.31:62095 > 40.104.46.50:https A | Reason: TCP packet to blocked port 443
Blocked: Ether / IP / TCP 192.168.1.31:62095 > 40.104.46.50:https PA / Raw | Reason: TCP packet to blocked port 443
Blocked: Ether / IP / TCP 192.168.1.31:62095 > 40.104.46.50:https PA / Raw | Reason: TCP packet to blocked port 443
Blocked: Ether / IP / TCP 192.168.1.31:62210 > 157.90.91.73:https A / Raw | Reason: Blocked TCP protocol
Blocked: Ether / IP / TCP 157.90.91.73:https > 192.168.1.31:62210 A | Reason: Blocked TCP protocol
Blocked: Ether / IP / TCP 34.198.52.31:https > 192.168.1.31:64728 A / Padding | Reason: Blocked TCP protocol
Blocked: Ether / IP / TCP 192.168.1.31:64728 > 34.198.52.31:https A | Reason: Blocked TCP protocol
Blocked: Ether / IP / TCP 34.198.52.31:https > 192.168.1.31:64727 A / Padding | Reason: Blocked TCP protocol
Blocked: Ether / IP / TCP 192.168.1.31:64727 > 34.198.52.31:https A | Reason: Blocked TCP protocol
Blocked: Ether / IP / TCP 208.103.161.2:https > 192.168.1.31:62097 PA / Raw | Reason: Blocked TCP protocol
Blocked: Ether / IP / TCP 192.168.1.31:62097 > 208.103.161.2:https PA / Raw | Reason: Blocked TCP protocol
Blocked: Ether / IP / TCP 208.103.161.2:https > 192.168.1.31:62097 A / Padding | Reason: Blocked TCP protocol
Blocked: Ether / IP / TCP 34.198.52.31:https > 192.168.1.31:64725 A / Padding | Reason: Blocked TCP protocol
Blocked: Ether / IP / TCP 192.168.1.31:64725 > 34.198.52.31:https A | Reason: Blocked TCP protocol
Blocked: Ether / IP / TCP 34.198.52.31:https > 192.168.1.31:64726 A / Padding | Reason: Blocked TCP protocol
Blocked: Ether / IP / TCP 192.168.1.31:64726 > 34.198.52.31:https A | Reason: Blocked TCP protocol
Blocked: Ether / IP / TCP 140.82.113.26:https > 192.168.1.31:64418 PA / Raw | Reason: Blocked TCP protocol
Blocked: Ether / IP / TCP 192.168.1.31:64418 > 140.82.113.26:https PA / Raw | Reason: Blocked TCP protocol
Blocked: Ether / IP / TCP 140.82.113.26:https > 192.168.1.31:64418 A / Padding | Reason: Blocked TCP protocol
Blocked: Ether / IP / TCP 34.198.52.31:https > 192.168.1.31:64729 A / Padding | Reason: Blocked TCP protocol
Blocked: Ether / IP / TCP 192.168.1.31:64729 > 34.198.52.31:https A | Reason: Blocked TCP protocol
Blocked: Ether / IP / TCP 40.104.46.50:https > 192.168.1.31:62095 PA / Raw | Reason: Blocked TCP protocol
Blocked: Ether / IP / TCP 192.168.1.31:62095 > 40.104.46.50:https PA / Raw | Reason: Blocked TCP protocol
Blocked: Ether / IP / TCP 192.168.1.31:62095 > 40.104.46.50:https PA / Raw | Reason: Blocked TCP protocol
Blocked: Ether / IP / TCP 40.104.46.50:https > 192.168.1.31:62095 A / Padding | Reason: Blocked TCP protocol
Blocked: Ether / IP / TCP 192.168.1.31:64762 > 20.189.173.14:https FA | Reason: Blocked TCP protocol
Blocked: Ether / IP / TCP 20.189.173.14:https > 192.168.1.31:64762 FA | Reason: Blocked TCP protocol
Blocked: Ether / IP / TCP 192.168.1.31:64762 > 20.189.173.14:https A | Reason: Blocked TCP protocol
Blocked: Ether / IP / TCP 208.103.161.2:https > 192.168.1.31:64731 PA / Raw | Reason: Blocked TCP protocol
Blocked: Ether / IP / TCP 192.168.1.31:64731 > 208.103.161.2:https PA / Raw | Reason: Blocked TCP protocol
Blocked: Ether / IP / TCP 208.103.161.2:https > 192.168.1.31:64731 A / Padding | Reason: Blocked TCP protocol
Blocked: Ether / IP / TCP 192.168.1.31:64651 > 142.250.65.225:https A / Raw | Reason: Blocked TCP protocol
Blocked: Ether / IP / TCP 142.250.65.225:https > 192.168.1.31:64651 A | Reason: Blocked TCP protocol
Blocked: Ether / IP / TCP 192.168.1.31:63667 > 172.64.155.209:https A / Raw | Reason: Blocked TCP protocol
Blocked: Ether / IP / TCP 172.64.155.209:https > 192.168.1.31:63667 A | Reason: Blocked TCP protocol
Blocked: Ether / IP / TCP 192.168.1.31:64347 > 40.71.11.167:https PA / Raw | Reason: Blocked TCP protocol
Blocked: Ether / IP / TCP 40.71.11.167:https > 192.168.1.31:64347 PA / Raw | Reason: Blocked TCP protocol
Blocked: Ether / IP / TCP 192.168.1.31:64347 > 40.71.11.167:https A | Reason: Blocked TCP protocol
Blocked: Ether / IP / TCP 192.168.1.31:63673 > 3.132.230.19:https A / Raw | Reason: Blocked TCP protocol
Blocked: Ether / IP / TCP 3.132.230.19:https > 192.168.1.31:63673 A | Reason: Blocked TCP protocol
Blocked: Ether / IP / TCP 192.168.1.31:64348 > 20.189.173.28:https PA / Raw | Reason: Blocked TCP protocol
Blocked: Ether / IP / TCP 192.168.1.31:64348 > 20.189.173.28:https PA / Raw | Reason: Blocked TCP protocol
Blocked: Ether / IP / TCP 192.168.1.31:64348 > 20.189.173.28:https PA / Raw | Reason: Blocked TCP protocol
Blocked: Ether / IP / TCP 192.168.1.31:62990 > 192.178.32.7:https A / Raw | Reason: Blocked TCP protocol
Blocked: Ether / IP / TCP 20.189.173.28:https > 192.168.1.31:64348 A / Padding | Reason: Blocked TCP protocol
Blocked: Ether / IP / TCP 20.189.173.28:https > 192.168.1.31:64348 PA / Raw | Reason: Blocked TCP protocol
Blocked: Ether / IP / TCP 20.189.173.28:https > 192.168.1.31:64348 A / Padding | Reason: Blocked TCP protocol
Blocked: Ether / IP / TCP 192.178.32.7:https > 192.168.1.31:62990 A | Reason: Blocked TCP protocol
Blocked: Ether / IP / TCP 192.168.1.31:64348 > 20.189.173.28:https A | Reason: Blocked TCP protocol
Blocked: Ether / IP / TCP 20.189.173.28:https > 192.168.1.31:64348 PA / Raw | Reason: Blocked TCP protocol
Blocked: Ether / IP / TCP 192.168.1.31:64348 > 20.189.173.28:https PA / Raw | Reason: Blocked TCP protocol
Blocked: Ether / IP / TCP 20.189.173.28:https > 192.168.1.31:64348 A / Padding | Reason: Blocked TCP protocol
Blocked: Ether / IP / TCP 192.168.1.31:64698 > 142.250.81.234:https A / Raw | Reason: Blocked TCP protocol
Blocked: Ether / IP / TCP 142.250.81.234:https > 192.168.1.31:64698 A | Reason: Blocked TCP protocol
Blocked: Ether / IP / TCP 208.103.161.2:https > 192.168.1.31:62097 PA / Raw | Reason: Blocked TCP protocol
Blocked: Ether / IP / TCP 192.168.1.31:62097 > 208.103.161.2:https PA / Raw | Reason: Blocked TCP protocol
Blocked: Ether / IP / TCP 208.103.161.2:https > 192.168.1.31:64731 PA / Raw | Reason: Blocked TCP protocol
Blocked: Ether / IP / TCP 192.168.1.31:64731 > 208.103.161.2:https PA / Raw | Reason: Blocked TCP protocol
Blocked: Ether / IP / TCP 208.103.161.2:https > 192.168.1.31:64731 A / Padding | Reason: Blocked TCP protocol
Blocked: Ether / IP / TCP 208.103.161.2:https > 192.168.1.31:62097 A / Padding | Reason: Blocked TCP protocol
Blocked: Ether / IP / TCP 34.198.52.31:https > 192.168.1.31:64724 A / Padding | Reason: Blocked TCP protocol
Blocked: Ether / IP / TCP 192.168.1.31:64724 > 34.198.52.31:https A | Reason: Blocked TCP protocol
Blocked: Ether / IP / TCP 34.198.52.31:https > 192.168.1.31:64728 A / Padding | Reason: Blocked TCP protocol
Blocked: Ether / IP / TCP 192.168.1.31:64728 > 34.198.52.31:https A | Reason: Blocked TCP protocol
Blocked: Ether / IP / TCP 192.168.1.31:64844 > 52.113.194.132:https S | Reason: Blocked TCP protocol
Blocked: Ether / IP / TCP 52.113.194.132:https > 192.168.1.31:64844 SA | Reason: Blocked TCP protocol
Blocked: Ether / IP / TCP 192.168.1.31:64844 > 52.113.194.132:https A | Reason: Blocked TCP protocol
Blocked: Ether / IP / TCP 192.168.1.31:64844 > 52.113.194.132:https PA / Raw | Reason: Blocked TCP protocol
Blocked: Ether / IP / TCP 52.113.194.132:https > 192.168.1.31:64844 A | Reason: Blocked TCP protocol
Blocked: Ether / IP / TCP 52.113.194.132:https > 192.168.1.31:64844 A / Raw | Reason: Blocked TCP protocol
Blocked: Ether / IP / TCP 52.113.194.132:https > 192.168.1.31:64844 A / Raw | Reason: Blocked TCP protocol
Blocked: Ether / IP / TCP 52.113.194.132:https > 192.168.1.31:64844 A / Raw | Reason: Blocked TCP protocol
Blocked: Ether / IP / TCP 52.113.194.132:https > 192.168.1.31:64844 A / Raw | Reason: Blocked TCP protocol
Blocked: Ether / IP / TCP 52.113.194.132:https > 192.168.1.31:64844 PA / Raw | Reason: Blocked TCP protocol
Blocked: Ether / IP / TCP 192.168.1.31:64844 > 52.113.194.132:https A | Reason: Blocked TCP protocol
Blocked: Ether / IP / TCP 192.168.1.31:64844 > 52.113.194.132:https PA / Raw | Reason: Blocked TCP protocol
Blocked: Ether / IP / TCP 192.168.1.31:64844 > 52.113.194.132:https PA / Raw | Reason: Blocked TCP protocol
Blocked: Ether / IP / TCP 52.113.194.132:https > 192.168.1.31:64844 A | Reason: Blocked TCP protocol
Blocked: Ether / IP / TCP 52.113.194.132:https > 192.168.1.31:64844 PA / Raw | Reason: Blocked TCP protocol
Blocked: Ether / IP / TCP 192.168.1.31:64844 > 52.113.194.132:https A | Reason: Blocked TCP protocol
Blocked: Ether / IP / TCP 52.113.194.132:https > 192.168.1.31:64844 A / Raw | Reason: Blocked TCP protocol
Blocked: Ether / IP / TCP 52.113.194.132:https > 192.168.1.31:64844 A / Raw | Reason: Blocked TCP protocol
Blocked: Ether / IP / TCP 192.168.1.31:64844 > 52.113.194.132:https A | Reason: Blocked TCP protocol
Blocked: Ether / IP / TCP 52.113.194.132:https > 192.168.1.31:64844 PA / Raw | Reason: Blocked TCP protocol
Blocked: Ether / IP / TCP 192.168.1.31:64844 > 52.113.194.132:https A | Reason: Blocked TCP protocol
Blocked: Ether / IP / TCP 192.168.1.31:64727 > 34.198.52.31:https A | Reason: TCP packet to blocked port 443
Blocked: Ether / IP / TCP 192.168.1.31:62140 > 104.18.35.15:https PA / Raw | Reason: TCP packet to blocked port 443
Blocked: Ether / IP / TCP 192.168.1.31:62140 > 104.18.35.15:https PA / Raw | Reason: TCP packet to blocked port 443
Blocked: Ether / IP / TCP 192.168.1.31:62140 > 104.18.35.15:https A | Reason: TCP packet to blocked port 443
Blocked: Ether / IP / TCP 192.168.1.31:62140 > 104.18.35.15:https PA / Raw | Reason: TCP packet to blocked port 443
Blocked: Ether / IP / TCP 192.168.1.31:62143 > 104.18.38.60:https PA / Raw | Reason: TCP packet to blocked port 443
Blocked: Ether / IP / TCP 192.168.1.31:62143 > 104.18.38.60:https PA / Raw | Reason: TCP packet to blocked port 443
Blocked: Ether / IP / TCP 192.168.1.31:62143 > 104.18.38.60:https A | Reason: TCP packet to blocked port 443
Blocked: Ether / IP / TCP 192.168.1.31:62143 > 104.18.38.60:https PA / Raw | Reason: TCP packet to blocked port 443
Blocked: Ether / IP / TCP 192.168.1.31:64348 > 20.189.173.28:https PA / Raw | Reason: TCP packet to blocked port 443
Blocked: Ether / IP / TCP 192.168.1.31:64348 > 20.189.173.28:https PA / Raw | Reason: TCP packet to blocked port 443
Blocked: Ether / IP / TCP 192.168.1.31:64348 > 20.189.173.28:https PA / Raw | Reason: TCP packet to blocked port 443
Blocked: Ether / IP / TCP 192.168.1.31:64348 > 20.189.173.28:https A | Reason: TCP packet to blocked port 443
Blocked: Ether / IP / TCP 192.168.1.31:64347 > 40.71.11.167:https PA / Raw | Reason: TCP packet to blocked port 443
Blocked: Ether / IP / TCP 192.168.1.31:64348 > 20.189.173.28:https PA / Raw | Reason: TCP packet to blocked port 443
Blocked: Ether / IP / TCP 192.168.1.31:64347 > 40.71.11.167:https A | Reason: TCP packet to blocked port 443
Blocked: Ether / IP / TCP 192.168.1.31:64725 > 34.198.52.31:https A | Reason: TCP packet to blocked port 443
Blocked: Ether / IP / TCP 192.168.1.31:64726 > 34.198.52.31:https A | Reason: TCP packet to blocked port 443
Blocked: Ether / IP / TCP 192.168.1.31:64729 > 34.198.52.31:https A | Reason: TCP packet to blocked port 443
Blocked: Ether / IP / TCP 192.168.1.31:62095 > 40.104.46.50:https PA / Raw | Reason: TCP packet to blocked port 443
Blocked: Ether / IP / TCP 192.168.1.31:62095 > 40.104.46.50:https PA / Raw | Reason: TCP packet to blocked port 443
Blocked: Ether / IP / TCP 192.168.1.31:64348 > 20.189.173.28:https PA / Raw | Reason: TCP packet to blocked port 443
Blocked: Ether / IP / TCP 192.168.1.31:64348 > 20.189.173.28:https PA / Raw | Reason: TCP packet to blocked port 443
Blocked: Ether / IP / TCP 192.168.1.31:64348 > 20.189.173.28:https A | Reason: TCP packet to blocked port 443
Blocked: Ether / IP / TCP 192.168.1.31:64852 > 216.24.57.252:https S | Reason: TCP packet to blocked port 443
Blocked: Ether / IP / TCP 192.168.1.31:64852 > 216.24.57.252:https A | Reason: TCP packet to blocked port 443
Blocked: Ether / IP / TCP 192.168.1.31:64852 > 216.24.57.252:https PA / Raw | Reason: TCP packet to blocked port 443
Blocked: Ether / IP / TCP 192.168.1.31:64853 > 104.18.43.158:https S | Reason: TCP packet to blocked port 443
Blocked: Ether / IP / TCP 192.168.1.31:64852 > 216.24.57.252:https A | Reason: TCP packet to blocked port 443
Blocked: Ether / IP / TCP 192.168.1.31:64853 > 104.18.43.158:https A | Reason: TCP packet to blocked port 443
Blocked: Ether / IP / TCP 192.168.1.31:64852 > 216.24.57.252:https PA / Raw | Reason: TCP packet to blocked port 443
Blocked: Ether / IP / TCP 192.168.1.31:64853 > 104.18.43.158:https PA / Raw | Reason: TCP packet to blocked port 443
Blocked: Ether / IP / TCP 192.168.1.31:64853 > 104.18.43.158:https A | Reason: TCP packet to blocked port 443
Blocked: Ether / IP / TCP 192.168.1.31:62097 > 208.103.161.2:https PA / Raw | Reason: TCP packet to blocked port 443
Blocked: Ether / IP / TCP 192.168.1.31:64853 > 104.18.43.158:https PA / Raw | Reason: TCP packet to blocked port 443
Blocked: Ether / IP / TCP 192.168.1.31:64852 > 216.24.57.252:https A | Reason: TCP packet to blocked port 443
Blocked: Ether / IP / TCP 192.168.1.31:64853 > 104.18.43.158:https A | Reason: TCP packet to blocked port 443
Blocked: Ether / IP / TCP 192.168.1.31:64854 > 216.24.57.252:https S | Reason: TCP packet to blocked port 443
Blocked: Ether / IP / TCP 192.168.1.31:64854 > 216.24.57.252:https A | Reason: TCP packet to blocked port 443
Blocked: Ether / IP / TCP 192.168.1.31:64854 > 216.24.57.252:https PA / Raw | Reason: TCP packet to blocked port 443
Blocked: Ether / IP / TCP 192.168.1.31:64855 > 216.24.57.4:https S | Reason: TCP packet to blocked port 443
Blocked: Ether / IP / TCP 192.168.1.31:64855 > 216.24.57.4:https A | Reason: TCP packet to blocked port 443
Blocked: Ether / IP / TCP 192.168.1.31:64855 > 216.24.57.4:https PA / Raw | Reason: TCP packet to blocked port 443
Blocked: Ether / IP / TCP 192.168.1.31:64854 > 216.24.57.252:https A | Reason: TCP packet to blocked port 443
Blocked: Ether / IP / TCP 192.168.1.31:64854 > 216.24.57.252:https PA / Raw | Reason: TCP packet to blocked port 443
Blocked: Ether / IP / TCP 192.168.1.31:64855 > 216.24.57.4:https A | Reason: TCP packet to blocked port 443
Blocked: Ether / IP / TCP 192.168.1.31:64855 > 216.24.57.4:https PA / Raw | Reason: TCP packet to blocked port 443
Blocked: Ether / IP / TCP 192.168.1.31:64854 > 216.24.57.252:https A | Reason: TCP packet to blocked port 443
Blocked: Ether / IP / TCP 192.168.1.31:64855 > 216.24.57.4:https A | Reason: TCP packet to blocked port 443
Blocked: Ether / IP / TCP 208.103.161.2:https > 192.168.1.31:64731 PA / Raw | Reason: Blocked TCP protocol
Blocked: Ether / IP / TCP 192.168.1.31:64731 > 208.103.161.2:https PA / Raw | Reason: Blocked TCP protocol
Blocked: Ether / IP / TCP 208.103.161.2:https > 192.168.1.31:64731 A / Padding | Reason: Blocked TCP protocol
Blocked: Ether / IP / TCP 192.168.1.31:64852 > 216.24.57.252:https FA | Reason: Blocked TCP protocol
Blocked: Ether / IP / TCP 216.24.57.252:https > 192.168.1.31:64852 FA | Reason: Blocked TCP protocol
Blocked: Ether / IP / TCP 192.168.1.31:64852 > 216.24.57.252:https A | Reason: Blocked TCP protocol
Blocked: Ether / IP / TCP 192.168.1.31:64853 > 104.18.43.158:https FA | Reason: Blocked TCP protocol
Blocked: Ether / IP / TCP 104.18.43.158:https > 192.168.1.31:64853 FA | Reason: Blocked TCP protocol
Blocked: Ether / IP / TCP 192.168.1.31:64853 > 104.18.43.158:https A | Reason: Blocked TCP protocol
Blocked: Ether / IP / TCP 192.168.1.31:64348 > 20.189.173.28:https PA / Raw | Reason: Blocked TCP protocol
Blocked: Ether / IP / TCP 192.168.1.31:64348 > 20.189.173.28:https PA / Raw | Reason: Blocked TCP protocol
Blocked: Ether / IP / TCP 192.168.1.31:64854 > 216.24.57.252:https FA | Reason: Blocked TCP protocol
Blocked: Ether / IP / TCP 20.189.173.28:https > 192.168.1.31:64348 A / Padding | Reason: Blocked TCP protocol
Blocked: Ether / IP / TCP 20.189.173.28:https > 192.168.1.31:64348 A / Padding | Reason: Blocked TCP protocol
Blocked: Ether / IP / TCP 20.189.173.28:https > 192.168.1.31:64348 PA / Raw | Reason: Blocked TCP protocol
Blocked: Ether / IP / TCP 192.168.1.31:64348 > 20.189.173.28:https PA / Raw | Reason: Blocked TCP protocol
Blocked: Ether / IP / TCP 192.168.1.31:64855 > 216.24.57.4:https FA | Reason: Blocked TCP protocol
Blocked: Ether / IP / TCP 216.24.57.252:https > 192.168.1.31:64854 FA | Reason: Blocked TCP protocol
Blocked: Ether / IP / TCP 192.168.1.31:64854 > 216.24.57.252:https A | Reason: Blocked TCP protocol
Blocked: Ether / IP / TCP 216.24.57.4:https > 192.168.1.31:64855 FA | Reason: Blocked TCP protocol
Blocked: Ether / IP / TCP 192.168.1.31:64855 > 216.24.57.4:https A | Reason: Blocked TCP protocol
Blocked: Ether / IP / TCP 20.189.173.28:https > 192.168.1.31:64348 A / Padding | Reason: Blocked TCP protocol
Blocked: Ether / IP / TCP 192.168.1.31:64616 > 104.114.79.145:https A / Raw | Reason: Blocked TCP protocol
Blocked: Ether / IP / TCP 192.168.1.31:64619 > 104.114.79.178:https A / Raw | Reason: Blocked TCP protocol
Blocked: Ether / IP / TCP 192.168.1.31:64618 > 104.117.182.176:https A / Raw | Reason: Blocked TCP protocol
Blocked: Ether / IP / TCP 104.114.79.178:https > 192.168.1.31:64619 A | Reason: Blocked TCP protocol
Blocked: Ether / IP / TCP 104.114.79.145:https > 192.168.1.31:64616 A | Reason: Blocked TCP protocol
Blocked: Ether / IP / TCP 104.117.182.176:https > 192.168.1.31:64618 A | Reason: Blocked TCP protocol
Blocked: Ether / IP / TCP 192.168.1.31:64617 > 104.114.79.209:https A / Raw | Reason: Blocked TCP protocol
Blocked: Ether / IP / TCP 104.114.79.209:https > 192.168.1.31:64617 A | Reason: Blocked TCP protocol
Blocked: Ether / IP / TCP 192.168.1.31:65522 > 40.97.188.242:https PA / Raw | Reason: TCP packet to blocked port 443
Blocked: Ether / IP / TCP 192.168.1.31:65522 > 40.97.188.242:https A | Reason: TCP packet to blocked port 443
Blocked: Ether / IP / TCP 192.168.1.31:65522 > 40.97.188.242:https A | Reason: TCP packet to blocked port 443
Blocked: Ether / IP / TCP 192.168.1.31:49397 > 52.21.152.152:https A | Reason: TCP packet to blocked port 443
Blocked: Ether / IP / TCP 192.168.1.31:49397 > 52.21.152.152:https A | Reason: TCP packet to blocked port 443
Blocked: Ether / IP / TCP 192.168.1.31:49262 > 108.138.114.80:https A / Raw | Reason: TCP packet to blocked port 443
Blocked: Ether / IP / TCP 192.168.1.31:49676 > 34.120.32.134:https A / Raw | Reason: TCP packet to blocked port 443
Blocked: Ether / IP / TCP 192.168.1.31:65511 > 3.14.178.229:https A / Raw | Reason: TCP packet to blocked port 443
Blocked: Ether / IP / TCP 192.168.1.31:65516 > 208.103.161.2:https PA / Raw | Reason: TCP packet to blocked port 443
Blocked: Ether / IP / TCP 192.168.1.31:49282 > 3.171.138.198:https A / Raw | Reason: TCP packet to blocked port 443
Blocked: Ether / IP / TCP 192.168.1.31:49288 > 13.33.249.107:https A / Raw | Reason: TCP packet to blocked port 443
Blocked: Ether / IP / TCP 192.168.1.31:65516 > 208.103.161.2:https PA / Raw | Reason: TCP packet to blocked port 443
Blocked: Ether / IP / TCP 192.168.1.31:49155 > 208.103.161.2:https PA / Raw | Reason: TCP packet to blocked port 443
Blocked: Ether / IP / TCP 192.168.1.31:49682 > 13.107.246.40:https A / Raw | Reason: TCP packet to blocked port 443
Blocked: Ether / IP / TCP 192.168.1.31:65522 > 40.97.188.242:https PA / Raw | Reason: TCP packet to blocked port 443
Blocked: Ether / IP / TCP 192.168.1.31:65522 > 40.97.188.242:https PA / Raw | Reason: TCP packet to blocked port 443
Blocked: Ether / IP / TCP 192.168.1.31:49155 > 208.103.161.2:https PA / Raw | Reason: TCP packet to blocked port 443
Blocked: Ether / IP / TCP 192.168.1.31:49262 > 108.138.114.80:https A | Reason: TCP packet to blocked port 443
Blocked: Ether / IP / TCP 192.168.1.31:49269 > 52.204.228.205:https A / Raw | Reason: TCP packet to blocked port 443
